Chevrolet Nubira 1.6,"4,300 лв.","2007, Газ/Бензин, 203000 км.","частно лице, Варна","Колата е много запазена като ходова част , двигател и купе . Винаги потдърж...",https://www.cars.bg/offer/66cefc7d4e5d15d52209f842
Chevrolet Epica 2.0*140*k.c*,"3,777 лв.","2006, Бензин, 208268 км.","КЕМАЛОВ АВТО, Казанлък",!! ! ХУБАВИ АВТОМОБИЛИ НА ИЗГОДНИ ЦЕНИ ! !! ! –––– ! ! ! ! Заповядайте п...,https://www.cars.bg/offer/657c4dce37424aaac80447b2
Mercedes-Benz A 200 2.0 бемзин,"4,999 лв.","2005, Бензин, 149000 км.","STOYKOVI KARS EOOD, Благоевград",Отлично състояние летни зимни гуми,https://www.cars.bg/offer/669a75c90f0a4d083209a947
"VW Bora 2.0,i","3,250 лв.","2001, Бензин, 230000 км.","частно лице, Лом",Нов внос от Германия.ПЕРФЕКТЕН.Топ състояние.Безупречен.,https://www.cars.bg/offer/66ce2b7f71fecd5f900cb434
VW Bora 2.0,"3,350 лв.","2004, Бензин, 205000 км.","частно лице, Лом",Нов внос от Германия.Всички система и агрегати работят.Абсолютно здрав авто...,https://www.cars.bg/offer/66ce2527924e6ee2d6078a95
Opel Zafira 1.8 i,"4,350 лв.","2007, Бензин, 178000 км.","частно лице, Лом",Нов внос от Германия.Реални километри.Топ състояние 7 места,https://www.cars.bg/offer/66ce1e40739bd1572e0435a3
Peugeot 607 3.0,"4,500 лв.","2002, Газ/Бензин, 278000 км.","частно лице, Търговище","Колата е поддържана редовно. Кара се всеки ден, всички екстри за модела. Га...",https://www.cars.bg/offer/65e89bd81c1ce6baec091595
Mercedes-Benz A 200 2000,"3,555 лв.","2006, Бензин, 133000 км.","частно лице, Враца",В перфектно състояние плюс 4 алуминиеви джанти с гуми,https://www.cars.bg/offer/66ce0ab6bc75f06a4c0816d4
Mercedes-Benz C 180 2000 cc,"5,900 лв.","2001, Газ/Бензин, 230000 км.","частно лице, Пазарджик","Ц класа 2001г газ,бензин.230000km,подържана Екстри: Ел.пакет,двузонен к...",https://www.cars.bg/offer/663fd15ac3e40c8b0109bf62
"Opel Zafira 2,2 direct","5,100 лв.","2006, Бензин, 215801 км.","частно лице, Силистра","Обслужване от опел сервиз,с гаранция на помпата високо налягане, масло смен...",https://www.cars.bg/offer/66cdddfe7aae7cb7410402f5
Ford Mondeo 1.8i 16V First,"3,500 лв.","2004, Бензин, 350000 км.","частно лице, Стара Загора",Колата съм си я докарал от Холандия на самоход Регистрирана е тук от 2023 ...,https://www.cars.bg/offer/66880e968d88956e59072e03
Mitsubishi Colt 1.5,"5,300 лв.","2006, Бензин, 196500 км.","частно лице, Стара Загора","Колата е внос от Германия.Сменени масло, филтри, антифриз предни и задни ди...",https://www.cars.bg/offer/652d1b2cfae093e094013b13
Volvo V50 2.4,"5,200 лв.","2004, Бензин, 257000 км.","Merco Cars, Дулово","Merco Cars Ви представя автомобили които са внос от Австрия,Германия,Белги...",https://www.cars.bg/offer/668b9c61d1f90d247a001e48
Hyundai i30 CW 1.4i Facelift,"5,600 лв.","2012, Бензин, 172000 км.","частно лице, Козлодуй",Всичко работи безупречно,https://www.cars.bg/offer/66a84531909b17461e0fcce2
Seat Alhambra 1.8T 150кс,"5,900 лв.","2006, Бензин, 193000 км.","частно лице, Козлодуй",Перфектно състоияние.Сменен ангренаж .,https://www.cars.bg/offer/66670ae8139274c34f094534
Fiat Grande Punto 1.4i GAZ,"5,999 лв.","2008, Газ/Бензин, 136342 км.","BICA CARS, Пловдив",,https://www.cars.bg/offer/652fdcf0a08c451752057993
Kia Carens 1.8 i,"3,500 лв.","2001, Газ/Бензин, 208000 км.","частно лице, Пловдив","Продавам Киа Каренс 1, 8i 16V 2001 година, 110 к. с. , газов инжекцион течн...",https://www.cars.bg/offer/65f0980891872f53390fcec5
Mercedes-Benz C 180 2.0 газ бензин,"4,250 лв.","2001, Газ/Бензин, 264000 км.","частно лице, Асеновград","Газбензин много икономична.Регистрирана,всичко платено",https://www.cars.bg/offer/66a2728e77ffa170e903be02
Chevrolet Epica,"6,000 лв.","2007, Газ/Бензин, 330000 км.","частно лице, Сопот","Изключително запазен автомобил. Винетка,застраховка,преглед до 18.04.2025г....",https://www.cars.bg/offer/66ccc9aaf5c38167490fdbd6
Renault Scenic 2.0 16v,"2,500 лв.","2003, Бензин, 212680 км.","частно лице, Видин","Внос от Швейцария, с платено мито и ддс. Сменени ангренажен ремък, ролки и ...",https://www.cars.bg/offer/62a6df896d087c01270d5a86
Citroen C4 1.6 бензин,"4,200 лв.","2005, Газ/Бензин, 208965 км.","частно лице, Хасково",Напълно обслужена. Леки забележки. (Отлепен таван),https://www.cars.bg/offer/65edbe339e56c55f560d4db4
Mazda 6 2.0 147 бензин,"4,500 лв.","2006, Бензин, 170000 км.","AUTOPEP, Стара Загора",Нов внос обслужена без никакви забележки Музика bose Отлична кола Клим...,https://www.cars.bg/offer/654cbaf3ea776ced840928db
Toyota Avensis 1.8 бензин,"5,450 лв.","2006, Бензин, 180000 км.","AUTOPEP, Стара Загора",В добро състояние. Катализатор годен за регистрация и технически прегле...,https://www.cars.bg/offer/654cab758f4cfc707d0f816a
"Renault Scenic 1,6 i","5,000 лв.","2007, Газ/Бензин, 223000 км.","частно лице, Велико Търново",Автомобилът е в перфектно техническо състояние и с всички платени такси.,https://www.cars.bg/offer/66aa7640e46e5a6a5d002d24
Peugeot 407 SW 2.2 benzin,"4,990 лв.","2007, Бензин, 200000 км.","bg auto, Враца",,https://www.cars.bg/offer/66194cf05558824c930ca214
Subaru Legacy 2.0,"5,000 лв.","2005, Бензин, 216448 км.","частно лице, София",Автомобила е в много добро състояние. Дребни козметични забележки. Перфекте...,https://www.cars.bg/offer/6643335b8b3f7003140b2123
Opel Vectra 2.2i,"3,000 лв.","2004, Газ/Бензин, 280000 км.","частно лице, Своге","Отлична работа на мотора, здрава ходова част. Нов съединител. Безпроблемна ...",https://www.cars.bg/offer/66cc94772a0aaffe1809e0e2
Kia Carens 2.0,"4,900 лв.","2006, Бензин, 240000 км.","частно лице, София",Нов внос Нидерландия.Сервизиран Kia Нидерландия.,https://www.cars.bg/offer/66cc8f5ecadf5cdd0b0ccd06
"Subaru Legacy 2,5 165","5,999 лв.","2004, Газ/Бензин, 269000 км.","частно лице, Варна","Нов изпърител,нови кабели, свещи, филтри. Масло , годишна винетка, гражданс...",https://www.cars.bg/offer/66a8e3d12969f25d4c0114a3
Peugeot 407 1.8,"4,800 лв.","2006, Бензин, 240000 км.","частно лице, София",Нов внос Нидерландия.Топ!,https://www.cars.bg/offer/66cc8c224e06a26901026fc3
Nissan Primera 1.8I,"2,900 лв.","2002, Бензин, 151939 км.","Bullsauto, София","Автокъща '' Булсауто'' , предлага широка гама от услуги свързани с покупкат...",https://www.cars.bg/offer/667010ca8a4a71dd2f0603c3
BMW 116 116i,"5,100 лв.","2007, Бензин, 250000 км.","частно лице, Варна",,https://www.cars.bg/offer/661056a1a1e4c01365093694
Renault Scenic 1.6 I 16V,"4,000 лв.","2004, Бензин, 195960 км.","Шепо и син, Нови пазар",Внос от Холандия.Перфектно техническо състояние. Отлично запазен интериор. ...,https://www.cars.bg/offer/645a30698ae8ca6224024b93
Renault Megane 1.6 I,"4,000 лв.","2003, Бензин, 169567 км.","Шепо и син, Нови пазар",Внос от Холандия. Перфектно техническо състояние. Отлично запазен интериор....,https://www.cars.bg/offer/66476d3e2878adf9ab0ad9e5
Citroen Xsara Picasso 1.8 I 16V,"3,700 лв.","2000, Бензин, 154752 км.","Шепо и син, Нови пазар",Внос от Холандия.Перфектно техническо състояние. Отлично запазен интериор. ...,https://www.cars.bg/offer/645a32f9e2c4a2f84c0e19c4
Seat Leon 2.0 Швейцария,"5,300 лв.","2005, Бензин, 217000 км.","частно лице, Враца",Автомобила е внос от Швейцария без забележки с два ключа платено мито включ...,https://www.cars.bg/offer/667b464c6d2b6babf70ae067
VW Bora 2.0,"5,252 лв.","2001, Бензин, 168000 км.","частно лице, Ловеч",Наличен Катализатор!Климатроник и всички екстри работят!Няма належащи ремон...,https://www.cars.bg/offer/66b3883b0ad5a9adc9096f52
Renault Megane 1.6i,"3,999 лв.","2007, Бензин, 201000 км.","AVTOSALON ELEGANT CAR, Варна",,https://www.cars.bg/offer/63a442dd67c1c1f27e0c6763
Renault Espace 2.0T 170 к.с.,"5,800 лв.","2005, Бензин, 208000 км.","частно лице, Велико Търново","Автомобила е 7 местен и са налични и 5-те седалки седалки отзад, обслужен о...",https://www.cars.bg/offer/66b5c731b1218f7229091893
Mercedes-Benz C 200 KOMPRESSOR,"3,599 лв.","2001, Газ/Бензин, 449366 км.","частно лице, Пловдив","Автомобила е в добро състояние, карам го от пет години. Има италианска газо...",https://www.cars.bg/offer/66cc2d009f607b13c60fd292
Audi A4 2.0 бензин,"3,700 лв.","2005, Бензин, 219000 км.","частно лице, Варна",Колата е технически перфектна! Има много леки външни забележки. -Климатро...,https://www.cars.bg/offer/660d748e0076b57651064b94
BMW 316 1.8 I,"5,000 лв.","2003, Бензин, 248300 км.","частно лице, Пловдив",Продавам личния си автомобил BMW E46/316/18/118КС може и коментар на цената...,https://www.cars.bg/offer/66cb5ea517310e46d005f4b3
VW Passat 2.0i 130кс.,"5,200 лв.","2003, Газ/Бензин, 235000 км.","частно лице, Разград","Колата е напълно обслужена преди 3000км.масла, ремъци, ролки, антифриз. С ч...",https://www.cars.bg/offer/64d881938d14518d63013422
Ford Mondeo,"4,000 лв.","2006, Газ/Бензин, 288638 км.","частно лице, Бургас","Колата е закупена от Гърция, като километрите са напълно реални. Доста добр...",https://www.cars.bg/offer/6667535ce65691f2250807b2
"Chevrolet Nubira 1,6i-KLIMATIK-","3,999 лв.","2007, Бензин, 190000 км.","PACHO-BRP, Монтана","НОВ ВНОС ТОП СЪСТОЯНИЕ . Колата е с отлично работещ мотор , стегната ходова...",https://www.cars.bg/offer/63a47505c9ea43f8ee0dc4f2
Opel Zafira 1.8 125,"5,400 лв.","2003, Бензин, 126772 км.","частно лице, София",Колата е внос от Холандия докарана на ход Гаражен автомобил без точка ръжд...,https://www.cars.bg/offer/66b0a3a7b6eab693590d6fd7
Mazda Tribute 2.0i 4x4,"5,900 лв.","2001, Бензин, 162000 км.","частно лице, София",Нов внос. Много запазен за годините си джип. На реални 162000км. Един собст...,https://www.cars.bg/offer/653ad6624659924ba40fb404
Peugeot 307 2.0i,"6,000 лв.","2007, Бензин, 150000 км.","частно лице, София",Нов внос Германия. Автомобилът е на реални 150000км. Налична сервизна книжк...,https://www.cars.bg/offer/654a9744b303add8fa0e1473
Opel Astra SW 1.6i FACE,"5,999 лв.","2009, Бензин, 217000 км.","КМ ИНТЕРАУТО, София",Автомобилът е в перфектно техническо състояние | Напълно обслужен и готов з...,https://www.cars.bg/offer/66cb405c86ce5d8e3b03c092
Citroen C3,"3,700 лв.","2002, Бензин, 150000 км.","частно лице, Пловдив","Автомобилът се кара всеки ден , винаги обслужван на време безкомпромисно. Н...",https://www.cars.bg/offer/66b91861694619d77d0ff5e3
Chrysler PT Cruiser 1.6i,"5,200 лв.","2002, Бензин, 165800 км.","частно лице, Велико Търново","Представям Ви ""Принцесата на Ротердам""! Автомобилът е закупен лично от първ...",https://www.cars.bg/offer/66cb0c8e3da872f0150be022
"Ford C-Max 2. 0 бензин,газ","4,000 лв.","2006, Газ/Бензин, 298000 км.","частно лице, Добрич","Колата е в добро състояние, поддържана е, има лека ръжда на преден ляв калн...",https://www.cars.bg/offer/66caf20f7a894d3654006f02
Citroen C4 2.0 136ps,"4,400 лв.","2005, Газ/Бензин, 176000 км.","частно лице, Добрич",Колата е закупена от мен преди 4г на 145000 тогава е обслужена. Тогава е по...,https://www.cars.bg/offer/6682d5a0d9c96e50490af7b6
Mercedes-Benz C 200 W203 Avantgarde,"5,000 лв.","2001, Газ/Бензин, 253000 км.","частно лице, Пазарджик",W203 Mercedes-Benz C200 Kompressor с газов инжекцион. Автомобилът е в добро...,https://www.cars.bg/offer/66b8dbd78cff37e76c0684b2
Peugeot 207 1.6 I SWISS,"4,400 лв.","2007, Бензин, 252000 км.","Stilavto, Враца",Нов внос Швейцария! Без точка ръжда по купето! Мотор и скорости перфектни! ...,https://www.cars.bg/offer/66b9fffdeba8aab4610766b3
Renault Scenic 2000 16 139 кс,"5,200 лв.","2000, Газ/Бензин, 258000 км.","частно лице, Стара Загора",Всичко работещо и платено рециклиран кардан в отлично състояние 4/4,https://www.cars.bg/offer/66cac6684ee3ac1085095bd3
Volvo S40 2.0,"4,100 лв.","2001, Газ/Бензин, 263500 км.","частно лице, Стара Загора",Всички екстри са в изправност!!! Сменени ангренажен ремък и ролки:240000км....,https://www.cars.bg/offer/6644e3fb3b265a99d00624c3
Mitsubishi Grandis 2.4 Газ инж.,"3,500 лв.","2005, Газ/Бензин, 303000 км.","частно лице, Дерманци",Здравейте продава се миниван перфектен на ходова част двигател скорости и в...,https://www.cars.bg/offer/66c9fdab8c8166865f0f2802
Ford Focus 2.0-145кс.КЛИМА,"5,988 лв.","2006, Бензин, 256300 км.","AUTO TRADERS, София","Нов внос. 2. 0-145кс. Ghia. 4 ел. стъкла, мулти волан+автопилот, Подгряване...",https://www.cars.bg/offer/667af221e12b4159b50f9c52
Ford Focus 1.6-115кс.КЛИМА,"4,988 лв.","2007, Бензин, 217000 км.","AUTO TRADERS, София","Нов внос, 1. 6-115кс. ел. стъкла, мулти волан, работещ климатик, оригинални...",https://www.cars.bg/offer/662dd59641e9c33fd5044cb2
Toyota Avensis 2.0i 147 кс,"4,900 лв.","2003, Бензин, 206800 км.","CARBROS, Пловдив","ЛИЗИНГ само срещу лична карта - бързо одобрение на място, без доказване на ...",https://www.cars.bg/offer/6639f4dc790f633d2a0f0462
Subaru Legacy 2000 кубика 165,"4,999 лв.","2005, Газ/Бензин, 270000 км.","частно лице, Тетевен",За повече информация позвънете !!!,https://www.cars.bg/offer/6649017b6bbb9f872c080eb4
Citroen Xsara Picasso 1.8i,"4,500 лв.","2004, Газ/Бензин, 241300 км.","частно лице, Дулово","Колата е в много добро състояние,обслужвана винаги на време, всичко е запис...",https://www.cars.bg/offer/660e558e9a47ff4f2004dff2
VW Passat 1.8I TURBO,"4,900 лв.","2002, Бензин, 198700 км.","haskovocarsbg, Хасково","Внос от Швейцария. Цената е с платено мито и ДДС! С фактура, без нотариални...",https://www.cars.bg/offer/6687da7596656d48c908c915
VW Touran 2.0I,"5,900 лв.","2004, Бензин, 187988 км.","haskovocarsbg, Хасково","Внос от Швейцария. Цената е с платено мито и ДДС! С фактура, без нотариални...",https://www.cars.bg/offer/652a71e9c89d70e8720468c8
Fiat Grande Punto 1.4 TURBO kli,"5,450 лв.","2009, Бензин, 162850 км.","Аутекс Груп ООД, Враца",Нов внос от Италия. Възможност за ПРОБА с транзитни номера. Съдействие за...,https://www.cars.bg/offer/66728444a6ba701f400e12f3
Citroen C4 1.6 БЕНЗИН-109к,"4,600 лв.","2006, Бензин, 187000 км.","Внос на автомобили от Германия, Русе",Нов внос CITROEN C4-1.6БЕНЗИН-109к.с.-2006г.!!!!!!КЛИМАТРОНИК !!!!!ПЕРФЕКТН...,https://www.cars.bg/offer/662bf567df18f15836040015
Ford Focus 1.6i*116кс*,"5,999 лв.","2008, Бензин, 180000 км.","СТОЕВИ АУТО, Стара Загора",Директен вносител на подбрани автомобили с дългогодишен опит. ЕВРО 4. Възмо...,https://www.cars.bg/offer/65b3cd76e8ebb2a5380e3284
BMW 525 E39 i Face,"5,300 лв.","2000, Газ/Бензин, 289000 км.","частно лице, Несебър",Документално изрядна Ходова част и двигател в отлично състояние нормални с...,https://www.cars.bg/offer/66939b960b9f3fa39f0b5d72
Opel Vectra 1.8,"3,000 лв.","2004, Газ/Бензин, 308000 км.","частно лице, Хасково",Колата е обслужвана винаги на време здрав и надежден автомобил.НЕ ГОРИ МАСЛ...,https://www.cars.bg/offer/66c2f6436ab04f18d6022622
VW Golf 1600,"2,800 лв.","2006, Бензин, 280000 км.","частно лице, Враца",Голф 4 обслужен напълно ремъци ролки масла дискове накладки климатроник раб...,https://www.cars.bg/offer/66c4c24d534a14040601a362
Nissan Primera 1.8,"3,545 лв.","2000, Бензин, 189756 км.","ТЕО ДАР ИНГ 56ООД, Бургас","Колата е със сменено динамо и ремонтиран стартер.Климатрoника работи ,не е ...",https://www.cars.bg/offer/5da418bbf969787ed80f528d
VW Bora 2.3 V 5,"5,289 лв.","2001, Газ/Бензин, 240726 км.","ТЕО ДАР ИНГ 56ООД, Бургас","Колaта е със нови вериги и гумички на клапаните ,гарнитури ролки и оптега...",https://www.cars.bg/offer/5da4169c29cd0f5e09795212
BMW 320 2.2 i-170 к.с.,"5,999 лв.","2003, Бензин, 241539 км.","ВЕРСУС АУТО, Пловдив","Нов внос , автомобила е в перфектно техническо състояние , много запазен въ...",https://www.cars.bg/offer/6602b97efd3a93fb6e04de6a
Hyundai i30 1.6i,"4,999 лв.","2007, Бензин, 218000 км.","iv4oauto, Враца",Нов внос реално състояние без корекции. Перфектна работа на мотора и стегна...,https://www.cars.bg/offer/63677f87d8f492f057072922
Mazda 5 1.8i (6+1),"4,300 лв.","2006, Бензин, 170000 км.","Автопарк Лукс, Мездра",,https://www.cars.bg/offer/66a4b3137b4ba23f70000d38
Peugeot Partner 1.6i 109,"4,200 лв.","2004, Бензин, 223878 км.","частно лице, Петко Каравелово","Предлагам на вашето внимание Peugeot Partner 1.6i, произведен през 2004 год...",https://www.cars.bg/offer/668d51bfd2ccc6057204c043
Citroen Xsara Picasso 1.8i,"3,000 лв.","2003, Бензин, 259650 км.","частно лице, Варна",Много добро техническо състояние.Леки външни забележки.Има катализатор.През...,https://www.cars.bg/offer/66c857fa947e5d17100249e5
Nissan Almera Tino 1.8,"5,000 лв.","2005, Бензин, 206000 км.","частно лице, София",Продавам Нисан Алмера Тино! Колата е в много добро техническо състояние! Вс...,https://www.cars.bg/offer/66c83f2e716f85a5310cd6c2
Seat Altea 1.6 LPG,"5,300 лв.","2008, Газ/Бензин, 218000 км.","частно лице, Добрич","Технически много добре. Външни забележки, напукан лак. Предстоящ внос. Це...",https://www.cars.bg/offer/66c82c343214f3bc630aa202
Citroen C4 Picasso 1 8 BENZIN/Gaz,"5,888 лв.","2008, Бензин, 213000 км.","DPA Auto, София",ДИРЕКТЕН ВНОСИТЕЛ НОВ ВНОС ХОЛАНДИЯ ГАРАНТИРАН ПРОИЗХОД 100 %РЕАЛЕН ПРО...,https://www.cars.bg/offer/669646cc283bcead490767e4
"Renault Megane 1.6i, ГАЗ","5,700 лв.","2008, Газ/Бензин, 188530 км.","Екстра ауто, Велико Търново","Нов внос. Реални километри. Газова уредба, климатик, мултифункционален вола...",https://www.cars.bg/offer/66a1b054e36d8c62e9091a45
"Daewoo Nubira 1,8i GPLi,лимо","4,350 лв.","2005, Газ/Бензин, 201811 км.","Автооказион, Севлиево","Деу Нубира 1, 8i GPLi, 122к. с. , с регистрация, валидни такси, газов инжек...",https://www.cars.bg/offer/66219f0583d148b89c035442
Opel Vectra 1.8,"3,700 лв.","2005, Бензин, 190000 км.","частно лице, Бургас",Продава се дадения автомобил със добри гуми и джанти.,https://www.cars.bg/offer/668317798f456b151f030fb4
BMW 116 i Sport Packet,"5,400 лв.","2005, Бензин, 240000 км.","частно лице, Златица",Наличен катализатор! Минат преглед на 22.08.2024г. Перфектна работа на мо...,https://www.cars.bg/offer/66b8db051c6f27925c01cbe3
Mercedes-Benz C 200 2.0,"3,900 лв.","2001, Бензин, 171000 км.","АНИ АУТО, Гоце Делчев","Колата е в перфектно техническо състояние, гарантиран произход, нов внос от...",https://www.cars.bg/offer/66c73b51139a9df0810aa066
"Honda Civic 1,6 VTEC","3,600 лв.","2002, Бензин, 190000 км.","частно лице, Казанлък",Продавам Honda Civic 1.6 V-tec 110 к.с със здрав и икономичен двигател...,https://www.cars.bg/offer/659e8f591d3681001a03b652
Mazda 5 1.8i,"4,500 лв.","2006, Газ/Бензин, 223000 км.","частно лице, Враца","Автомобилът е обслужен, кара се всеки ден. Газовата уредба е на 3 години, в...",https://www.cars.bg/offer/66966e1d83902153c90baa83
VW Touran 1.6I-7 места,"5,900 лв.","2004, Бензин, 214000 км.","AUTO А1, Шумен","В много добро състояние, внос от Белгия. Докарана на собствен ход. 7 места,...",https://www.cars.bg/offer/66c72837833222e26e0125e3
Renault Laguna 1.6 i,"3,933 лв.","2006, Бензин, 185000 км.","РИНГ, Драгичево","Нов внос- докаран на собствен ход!Автомобила е в много добро състояние,възм...",https://www.cars.bg/offer/64fdaf667d828cab8e05c934
