Ford Focus 1.8i,"3,500 лв.","2000, Газ/Бензин, 170000 км.","частно лице, Русе","Продавам Ford Focus 1.8i 115 к.с. Леки забележки по купето, продава се с дв...",https://www.cars.bg/offer/66d9809d39430d5c7102e112
Seat Alhambra 2.0i 6 СКОРОСТИ,"4,800 лв.","2006, Бензин, 290000 км.","MELANI AUTO, Бяла Слатина",Вана е внесен от Холандия на ход. Чудесен външен вид и салон.Нови гуми. Реа...,https://www.cars.bg/offer/6663f75d3ea2ece7a202e802
Opel Zafira 1.8 7 mesta,"5,900 лв.","2009, Бензин, 168000 км.","MARTIN AUTO, Добрич",,https://www.cars.bg/offer/666af03246ea846d2e098c22
Honda Stream 2.0 GAZ,"5,500 лв.","2002, Газ/Бензин, 205000 км.","частно лице, София",,https://www.cars.bg/offer/64f61dcca15179135b07e573
Honda FR-V 1.7i,"5,800 лв.","2006, Бензин, 255000 км.","PANDA CAR, Смолян",- Продава се във вида в който е внесен със забележки по интериор и екстерио...,https://www.cars.bg/offer/665748b24687288a5209baf5
Honda Accord 2.0i/ LPG,"4,900 лв.","2003, Газ/Бензин, 288000 км.","PANDA CAR, Смолян","- Продава се технически и документално изряден автомобил, внос от Швейцария...",https://www.cars.bg/offer/668c2937b99abd8ee90d37c2
Citroen C4 Picasso 1.6,"3,000 EUR","2008, Бензин, 139100 км.","AVTO KAKCHIEV, Казанлък",Отлично състояние! Пълна сервизна история! Два ключа! Възможност за проверк...,https://www.cars.bg/offer/65a27c7d701f1975b003af33
"Mercedes-Benz C 200 kompressor,газ","4,199 лв.","2001, Газ/Бензин, 318700 км.","частно лице, София","Елеганс, газ-бензин 163кс, М111 не пипа грам масло и работи чудесно, 6 скор...",https://www.cars.bg/offer/66d95e12295398bbc703f2e2
Peugeot 307 SW 1.6 КЛИМАТРОНИК,"3,150 лв.","2006, Бензин, 220000 км.","частно лице, Монтана",Нов внос от Германия,https://www.cars.bg/offer/6693d87bfaf26be81002cab3
Nissan Primera 1.8 газ,"5,899 лв.","2004, Газ/Бензин, 288000 км.","частно лице, Асеновград",Продавам личния си автомобил. Перфектен техничесни и визуално.Нова предница...,https://www.cars.bg/offer/65edfb3bd754ac3d8b0fd715
BMW 318 1.8,"2,100 лв.","2002, Бензин, 204000 км.","частно лице, Варна",Колата се кара всеки ден има малки козметични забележки отвън и отвътре как...,https://www.cars.bg/offer/65d6695eb37696da0c0aea02
Peugeot 308 1.6i*120*k.c,"4,777 лв.","2008, Бензин, 285188 км.","КЕМАЛОВ АВТО, Казанлък","! ! ! Заповядайте при нас, ние имаме от всичко на добра цена, ако ли пък не...",https://www.cars.bg/offer/66d94cc420b68e2abc0dd257
Renault Modus 1.2*116*к.с,"2,377 лв.","2006, Бензин, 172304 км.","КЕМАЛОВ АВТО, Казанлък","! ! ! Заповядайте при нас, ние имаме от всичко на добра цена, ако ли пък не...",https://www.cars.bg/offer/66d94bc71959453bef0f0563
VW Jetta 1.6i,"5,800 лв.","2008, Бензин, 160000 км.","BULTRANS TG, Враца",,https://www.cars.bg/offer/658811fe8b77abf6fb065302
Mazda 5 2.0,"4,000 лв.","2005, Бензин, 226000 км.","частно лице, София","Обслужена, нови дискове и накладки, нова предница, нови амортесьори, всичко...",https://www.cars.bg/offer/6679be40c0147913d00635c2
BMW 318,"2,500 лв.","2000, Газ/Бензин, 212000 км.","частно лице, Каварна",Висок клас газов инжекцион на 5000 километра още в гаранция с всички докуме...,https://www.cars.bg/offer/66d88b31caa13801260061f2
Hyundai i30 CW 1.6 126 кс,"5,950 лв.","2009, Бензин, 188645 км.","частно лице, Враца",Нов внос С валидни транзитни номера Без корекций по интериора Много за...,https://www.cars.bg/offer/66d40c91b6963c56ef05df32
VW Bora 2.0i Comfortlin,"4,999 лв.","2005, Бензин, 220000 км.","АУТО МИМИ ЕООД, Плевен",,https://www.cars.bg/offer/66923c7360f184a4210cc373
BMW 316 1.6i с газ,"3,000 лв.","2001, Газ/Бензин, 290000 км.","частно лице, София",Двигателя не е с valvetronic както при по-чупливите фейслифтови двигатели! ...,https://www.cars.bg/offer/66d6c54fc72e58d6d3015259
Peugeot 307 1.6,"3,700 лв.","2005, Бензин, 249000 км.","частно лице, Велико Търново",Продава се: Peugeot 307 Двигател: Бензин 1.6 / 109 кс. Година: 2005 Н...,https://www.cars.bg/offer/66c76eeff674fb4ab4052762
Toyota Avensis 1.8i wwti/газ,"3,790 лв.","2002, Газ/Бензин, 236001 км.","частно лице, Варна",Колата е с платени всички документи.Газовото е вписано в талона и с газова ...,https://www.cars.bg/offer/6599957083048aa6340336e2
Renault Megane 1.6i,"4,100 лв.","2008, Бензин, 230000 км.","частно лице, Пордим",Нов внос от Германия докарана ход без точка ръжда много добро състояние,https://www.cars.bg/offer/661c2cf267dcd8e1c40ce194
Toyota Avensis 2.0 I,"5,900 лв.","2006, Бензин, 210000 км.","частно лице, Асеновград",перфектно състояние.нов внос,https://www.cars.bg/offer/65e5f3aeb5d0f1e50d032942
Mercedes-Benz C 200 компресор,"5,200 лв.","2000, Газ/Бензин, 270000 км.","частно лице, Габрово","Автомобила е в безупречно техническо състояние. Перфектна работа на мотора,...",https://www.cars.bg/offer/66cb39b89a0982eeed0d0be2
Mitsubishi Space Star 1.8 MPI,"4,000 лв.","2004, Газ/Бензин, 230000 км.","частно лице, Бяла (Русе)","Добро състояние,обслужвана навреме.Газовата уредба е вписана в талона.Прехв...",https://www.cars.bg/offer/66d88c9f3ad164902b0188f2
Renault Grand Scenic 1.6. 16v. 6ск,"5,700 лв.","2009, Бензин, 183238 км.","частно лице, Димитровград",В много добро състояние кара се всеки ден реални километри наличен катализа...,https://www.cars.bg/offer/66580b321969a2a6e501c823
BMW 318 1.8i,"5,990 лв.","2006, Бензин, 203000 км.","частно лице, Асеновград",Продава се! Бмв е91 1.8 бензин 129к.с. 2006г. На 203000км. 100% реални до...,https://www.cars.bg/offer/66cb2cea31d27ecf650f5f94
Peugeot 407 1.8i 116кс,"4,500 лв.","2006, Бензин, 175000 км.","AUTO CHIFLIKA, Враца",,https://www.cars.bg/offer/663ba4b0bec2f2eb9c077023
Toyota Avensis 1.8VVT-I 129HP,"5,500 лв.","2006, Бензин, 210761 км.","NEXT AUTO, Перник",Регистриран и обслужен автомобил ! ! ! Собствен лизинг ! ! ! Гарантиран про...,https://www.cars.bg/offer/645253bef0f31c642c0cfb72
Audi A6 2.0 TFSI,"6,000 лв.","2007, Бензин, 260000 км.","частно лице, Пловдив",Автомобила се кара всеки ден. Сменено PCV Сменен Пул на ПВН 2. Бр оригинал...,https://www.cars.bg/offer/66b4ae23e3bf5586ca023df3
VW Passat 1.8Т ГАЗ,"4,350 лв.","2002, Газ/Бензин, 290000 км.","частно лице, Берковица",В добро състояние. Газов инжекцион Всичко платено.,https://www.cars.bg/offer/65d1d3c23243ec13f20e4e12
Renault Scenic RX4 2.0 16v,"3,200 лв.","2002, Газ/Бензин, 280000 км.","частно лице, Варна","Колата е изправна,всичко е платено ,4х4 работи,газов инжекцион ,.За повече...",https://www.cars.bg/offer/65797e9e46f0185d3e063893
Mazda 6 2.0i 143ps 6sk,"4,999 лв.","2008, Бензин, 143000 км.","RED CAR, Хасково",,https://www.cars.bg/offer/6583255bc0efaca6d70554f4
Opel Zafira 1.8i 140ps,"5,750 лв.","2006, Бензин, 186000 км.","RED CAR, Хасково",,https://www.cars.bg/offer/65981966fed16b7f2004c595
Mazda 3 2.3,"5,200 лв.","2004, Бензин, 33000 км.","частно лице, София",Мазда 3 - 2.3 бензин/газ - Седан. 170коня Колата си има и плюсовете и мину...,https://www.cars.bg/offer/66cdda0aa96549153c04efa4
Renault Scenic RX4 2.0,"4,999 лв.","2002, Газ/Бензин, 152000 км.","частно лице, Бургас","Реални километри, Безупречно 4х4 Няма капка ръжда ,налични са и двата кат...",https://www.cars.bg/offer/6654702f4152d4fe0e00b787
"Renault Espace 2.0i 170кс,","4,600 лв.","2006, Бензин, 220000 км.","частно лице, Монтана",7 местен добро състояние,https://www.cars.bg/offer/66c8d027e08b9a763e0edf44
Seat Alhambra 2.0 i,"5,399 лв.","2005, Бензин, 206000 км.","Авто Пазар БГ, София","Нов внос в перфектно техническо и визуално състояние от първи собственик,но...",https://www.cars.bg/offer/663a2e94d85154ab32070b12
Peugeot 407 2.2 Бензин/ГАЗ,"4,499 лв.","2006, Газ/Бензин, 207893 км.","частно лице, София","Автомобилът е в движение. Платена винетка за 1 година, гражданска отговорно...",https://www.cars.bg/offer/66d1eb2a8ee08218ea03d313
Opel Signum 1.8,"3,500 лв.","2004, Газ/Бензин, 253000 км.","частно лице, Варна","Газова уредба BRC с нова бутилка, работи идеално на газ и на бензин без раз...",https://www.cars.bg/offer/664c57cc5c4414836d0f2523
VW Golf Plus 1.6i klima,"4,200 лв.","2005, Бензин, 197000 км.","ЕТ ""Боби и Томи Рейсинг"" ЕООД, Монтана","колата е внос от Германия технически изправна , има забележки на праговете ...",https://www.cars.bg/offer/6579d44ade538bbe8b0b29d4
Renault Scenic 1.6i klima,"2,700 лв.","2005, Бензин, 123000 км.","ЕТ ""Боби и Томи Рейсинг"" ЕООД, Монтана",Колата е внос от Германия технически изправна. Седействие при транзитни ном...,https://www.cars.bg/offer/66093a5219eafdc37107eb03
VW Touran 2.0i 150ks.,"3,999 лв.","2004, Бензин, 237000 км.","ЕТ ""Боби и Томи Рейсинг"" ЕООД, Монтана","колата е внос от Германия ,колата вдига само до 3000 оборота . Съдействие п...",https://www.cars.bg/offer/669398eacfaf82043a041ca3
VW Golf 1.4TSi,"5,800 лв.","2006, Бензин, 240215 км.","AVTO VESI, Враца","Колата е нов внос в добро състояние. Перфектно работещ мотор, стегната ходо...",https://www.cars.bg/offer/6668463aacf72769d803ca03
Volvo S40 1.8i,"5,200 лв.","2004, Бензин, 325864 км.","AVTO VESI, Враца","Колата е нов внос в добро състояние. Перфектно работещ мотор, стегната ходо...",https://www.cars.bg/offer/661d64b83a0773808d023ee4
VW Touran 1.6FSI 110кс,"5,900 лв.","2006, Бензин, 199999 км.","МАРМИНАУТО-ЕООД, Враца",Колата е НОВ ВНОС . . . . . . . . . . . . . . ! ! ! ! ! ! ! ! ! ! ! . . . ....,https://www.cars.bg/offer/66aa95d4605e2300c106a827
BMW 116,"5,300 лв.","2004, Бензин, 300000 км.","частно лице, Варна",В добро състояние има няколко козметични забележки коментар на цената само ...,https://www.cars.bg/offer/66a07fd469887eccde0a8dc2
Mazda 5 2.0i,"4,700 лв.","2007, Газ/Бензин, 220000 км.","частно лице, Сапарева баня",Колата е в отлично техническо състояние изцяло ревизирана без странични шум...,https://www.cars.bg/offer/66d5fe3b9a2a5dc6830e7bb2
"Renault Megane 1,6 бензин","5,310 лв.","2010, Бензин, 245000 км.","частно лице, Враца","Перфектно състояние, абсолютно всички възли и агрегати работят безипречно, ...",https://www.cars.bg/offer/65f4400bf264d6cc140eb11b
Citroen C4 1.6I 109кс EU 4,"4,400 лв.","2007, Бензин, 173901 км.","МАРМИНАУТО-ЕООД, Враца",Колата е НОВ ВНОС . . ! ! ! ! ! ! . . . . . . . . РЕАЛНИ 173 000 КИЛОМЕТРИ ...,https://www.cars.bg/offer/66d4b74b09470149a6046f66
Renault Modus 1.6 i,"4,500 лв.","2005, Бензин, 77000 км.","Автокъща Петър Петров, Дупница",УНИКАТ!,https://www.cars.bg/offer/665b31b58aac81f6b601cc4a
"BMW 116 1.6i,122к","5,999 лв.","2008, Бензин, 157500 км.","частно лице, Велико Търново","Нов внос Италия-Виченца. Един собственик, реални километри-доказуеми. Серви...",https://www.cars.bg/offer/66d6e7b6a41a5c65ae066d13
Peugeot 307 SW 2.0i,"4,900 лв.","2006, Газ/Бензин, 310000 км.","частно лице, Свиленград",2.0 кубика газ/бензин. Нова газова уредба слагана е юни месец миналата годи...,https://www.cars.bg/offer/66d7f409e0df6d99160aed84
Subaru Legacy 2.0,"5,800 лв.","2007, Бензин, 203833 км.","VAL AUTOS, Велико Търново",ВЪЗМОЖЕН БАРТЕР! Всичко по автомобила работи! Бързи и бавни скорости Кли...,https://www.cars.bg/offer/6685484de6dedb08ab065e8d
BMW 318 is,"4,398 лв.","2003, Бензин, 237000 км.","частно лице, Златоград","Всичко платено , обслужена сменена верига преди хиляда км . Без луфтове по ...",https://www.cars.bg/offer/666c046ad955b52f9002e526
Fiat Croma 1.8i,"3,899 лв.","2006, Бензин, 134722 км.","Автомобили Нов Внос от Италия, Джерман","Нов внос от Италия, перфектно състояние,много запазен автомобил,реални кило...",https://www.cars.bg/offer/66b09ab25855876c1d0ebae3
Subaru Legacy,"4,999 лв.","2005, Газ/Бензин, 111111 км.","частно лице, Хасково","Автомобилът е в много добро техническо състояние. Напълно обслужен, рецикли...",https://www.cars.bg/offer/65d091e502380c9406050852
"VW Golf Plus 1,6fsi GPL","4,200 лв.","2006, Газ/Бензин, 205000 км.","Ivikal auto, Карлово","Внос Италия в отлично техническо състояние с италианска газова уредба,нови ...",https://www.cars.bg/offer/667c5505a13ffaaa9a0cfd93
Subaru Legacy,"5,000 лв.","2005, Газ/Бензин, 260000 км.","частно лице, Русе","Предлагам Ви редовно подържан автомобил с редовна газова уредба, който се к...",https://www.cars.bg/offer/66015f9f379a7f843509de02
Chevrolet Epica 2.0,"5,000 лв.","2006, Газ/Бензин, 128300 км.","частно лице, Търговище","Юли 2006,Седан, Употребяван автомобил,В добро състояние, Газ/Бензин, 128 30...",https://www.cars.bg/offer/66a21efeded84bb1d3049423
Citroen C4,"5,699 лв.","2005, Газ/Бензин, 210500 км.","частно лице, Варна",Продавам семейният ни автомобил. Винаги обслужван навреме. Всичко е платено...,https://www.cars.bg/offer/664636766e0c65a036089b22
BMW 116 1.6,"5,500 лв.","2004, Бензин, 235710 км.","частно лице, Враца",Колата е внос от Швейцария! Без гнило и ръжди! Колата е обслужена от към ...,https://www.cars.bg/offer/65e8a5bb8b027e63180726a2
VW Golf 2.0i115k,"2,700 лв.","2000, Бензин, 200000 км.","Аутонас, Пазарджик",работи много добре,https://www.cars.bg/offer/661fea90458d91e73f023325
"Chevrolet Lacetti 1.8-121кс,Газ","4,300 лв.","2006, Газ/Бензин, 186263 км.","Bm Shop ltd, Монтана","Нов внос,перфектна работа на мотора ,стегната ходова част, интериор/екстери...",https://www.cars.bg/offer/6552433121110fb4e90897b2
BMW 316 е46 FACELIFT,"3,450 лв.","2003, Бензин, 247000 км.","частно лице, Лом","Автомобила е нов внос, и е изключително запазен техническо и визуално състо...",https://www.cars.bg/offer/66bca33fcc9dc5d85b08f9c4
Peugeot 307 1.6I ГАЗ,"2,899 лв.","2004, Газ/Бензин, 225000 км.","AUTOAKTIV, Враца",Налична на Автокъща Аутоактив. За оглед само с предварителна уговорка. Възм...,https://www.cars.bg/offer/660bfd4b7c92e1b2290baa54
VW Golf 1.6 fsi,"3,300 лв.","2003, Бензин, 201654 км.","частно лице, Луковит",Перфектно състояние! Без точка ръжда!,https://www.cars.bg/offer/652bba3fb4efc0b4820ed876
Peugeot 308 1.6i - KLIMA,"4,600 лв.","2008, Бензин, 140000 км.","Avto Elit-Vratsa, Враца",ЛИЗИНГ ЗА АВТОМОБИЛ С ОДОБРЕНИЕ ДО 20-МИНУТИ САМО СРЕЩУ ЛИЧНА КАРТА. НОВ ВН...,https://www.cars.bg/offer/6596b80a6a30e1b79d0c1093
Peugeot 308 1.6i TURBO,"4,499 лв.","2008, Бензин, 192000 км.","АВТОКЪЩА-АТИЯ, Бургас",Колата е регистрирана със всички документи платени може да се види по всяко...,https://www.cars.bg/offer/64d632717973b56efd0728b5
Great wall Hover H5 2.4I ГАЗ 4х4,"5,899 лв.","2012, Газ/Бензин, 205000 км.","AUTOAKTIV, Враца",Налична на Автокъща Аутоактив. За оглед само с предварителна уговорка. Възм...,https://www.cars.bg/offer/663cc926dc3da5d20a062573
Mazda Tribute 2.0,"6,000 лв.","2004, Газ/Бензин, 200000 км.","частно лице, Казанлък",Застраховката е платена за цяла година до юни 2025г.годишна винетка до март...,https://www.cars.bg/offer/66b48a24dfa427ef750271a2
Mazda 6,"3,600 лв.","2005, Бензин, 265404 км.","частно лице, Нови пазар",Колата е в добро състояние обслужвана винаги навреме . Мотор скорости и х...,https://www.cars.bg/offer/66c0e0eed866a6a6030a1113
Ford C-Max 1.8,"6,000 лв.","2005, Бензин, 235000 км.","частно лице, Велико Търново",,https://www.cars.bg/offer/66d6c05a010fa5ef340a1f72
"Renault Megane 1,6i 16V 112k.c","4,490 лв.","2006, Бензин, 198000 км.","Теси кар, Варна","Renault Megane 1,6i 16V 112k.c. Нов внос от Германия.",https://www.cars.bg/offer/66c340e5b8c85d60a50f02f2
Peugeot 308 SW 1.6 Gazov Injek,"6,000 лв.","2009, Газ/Бензин, 163609 км.","Шепо и син, Нови пазар",Внос от Холандия. Фабрична газова уредба. Перфектно техническо състояние. О...,https://www.cars.bg/offer/66d6b70d864592821907d0d3
Mazda 6 1.8i,"4,900 лв.","2006, Бензин, 231609 км.","IVEKAAUTO, Пловдив",Реален пробег със сервизна история.,https://www.cars.bg/offer/668fbf754cec3ba1b003d8b9
BMW 116 1.6,"6,000 лв.","2007, Газ/Бензин, 230000 км.","частно лице, Добрич",Kolata e M paket davana e alkantar ceren kolata ima gaz,https://www.cars.bg/offer/663c527b6ada31507d0e24a2
Honda FR-V 1.7 / 5+1 места,"5,600 лв.","2006, Бензин, 188000 км.","частно лице, Карлово",Колата е в перфектно състояние за повече информация ми звъннете на тел 0988...,https://www.cars.bg/offer/666703376dd0474204036d22
Ford C-Max 1.6i,"3,599 лв.","2006, Бензин, 250000 км.","частно лице, Велико Търново","В отлично състояние. Всичко по автомобила работи идеално, наличен катализат...",https://www.cars.bg/offer/65d1177732e3fd5a05000cc2
Opel Astra 1.8 16V 125 k.c,"5,750 лв.","2005, Бензин, 195 км.","частно лице, Разград","Продавам Опел-Астра 1.8, 16V, 125 к.с. В много добро състояние. Напълно обс...",https://www.cars.bg/offer/66b23d499722e02d3b0351f2
Toyota Corolla Verso 1.8 Бензин,"3,000 лв.","2002, Газ/Бензин, 251000 км.","частно лице, Хасково",Колата се продава с комплект 4 стоманени джанти със зимни гуми.,https://www.cars.bg/offer/66d5eda8b65e4d871502b642
VW Passat,"3,800 лв.","2006, Бензин, 230000 км.","частно лице, Червен бряг","Колата е в добро техническо състояние,запазен салон,всичко платено,сменена ...",https://www.cars.bg/offer/66c43d2b61ff6a7ede0a0382
BMW 116,"3,850 лв.","2005, Бензин, 269100 км.","НИК- АУТО, София",,https://www.cars.bg/offer/668262a6f0cb156ef50b1822
Opel Zafira 1.8i 7mesta,"4,800 лв.","2008, Бензин, 303000 км.","частно лице, Разград",Регистриран автомобил на реални километри и година. Технически изправен и д...,https://www.cars.bg/offer/667d0db7e96816ad030a1914
Ford C-Max 1.8i - 125hp,"4,200 лв.","2005, Бензин, 200000 км.","Аеро ауто, Плевен","Нов внос В много добро състояние Без курозия, без забелешки по салона ...",https://www.cars.bg/offer/66cd8315e02e92dee104c156
Ford Maverick 2.0i 4x4,"5,899 лв.","2003, Бензин, 190127 км.","VV Cars, Варна",4х4!!! РЕАЛНИ КИЛОМЕТРИ – 190 хил. км! Отлично техническо и визуално състоя...,https://www.cars.bg/offer/66d5a032cd31fb78980b8e62
Opel Zafira 2.2 direct,"5,700 лв.","2006, Бензин, 175000 км.","частно лице, Габрово",Автомобилът е в много добро състояния. Автомобилът е докаран на собствен х...,https://www.cars.bg/offer/6630f0d024d5b8095506a473
Renault Scenic,"5,899 лв.","2007, Бензин, 186224 км.","АВТОКЪЩА ПРИСЕЛЦИ, Варна",! ! ВНОС ОТ ГЕРМАНИЯ НА РЕАЛНИ КМ СЪС СЕРВИЗНА ИСТОРИЯ И 3 НАЛИЧНИ КЛЮЧА (К...,https://www.cars.bg/offer/6645d183b471f53c0d01acb4
"Subaru Impreza 2,0iR-4Х4-KLIMA","6,000 лв.","2006, Бензин, 191000 км.","PACHO-BRP, Монтана",НОВ ВНОС- FACE новия мотор 160кс. колата е от ГЕРМАНИЯ и е в ОТЛИЧНО ТЕХНИЧ...,https://www.cars.bg/offer/65451da1fe09d84cdf0f1ea9
Renault Vel Satis 2T 163k.c. ben,"5,800 лв.","2003, Бензин, 230000 км.","частно лице, Пловдив",Продавам Рено Велсатис 2Т 163 к. с. в добро състояние с следи от употреба с...,https://www.cars.bg/offer/5da41a3d6aa9c57342212a3a
Audi A6 2.0 Tfsi Face,"5,900 лв.","2010, Бензин, 325000 км.","частно лице, Варна","ДИРЕКТЕН ВНОС НА АВТОМОБИЛИ ,Добро техническо състояние ,ИМА ВЪНШНИ ЗАБЕЛЕЖ...",https://www.cars.bg/offer/6626c4315145994a2006c5e3
VW Sharan 2.0 benzin,"4,450 лв.","2002, Бензин, 184367 км.","Кешауто 17 Еоод, Добрич",,https://www.cars.bg/offer/659950085c225580840ef726
VW Touran 1.6.115.КС.БЕНЗ,"5,600 лв.","2004, Бензин, 220700 км.","Bati Auto, София",,https://www.cars.bg/offer/660e700e71e3c0559c089b72
VW Passat 2.0I,"4,300 лв.","2002, Бензин, 212000 км.","ИЛ АУТО, Сливен",Перфектно състояние. Нов внос.,https://www.cars.bg/offer/664f566b1c024b1c57018872
